{"regions":["r1","r2"],"objects":[{"id":"o1","kind":"entity","labels":["entity-a"],"regions":["r1","r2"]},{"id":"o2","kind":"entity","labels":["entity-b"],"regions":["r1"]}],"morphisms":[{"id":"m1","src":"o1","dst":"o2","relation_type":"has_part","claim_ids":["01JBQ6Z3V8K4M2N5P7R9T1W3X6"]}],"shape_metrics":{"hub_concentration":0.5,"longest_chain":1,"two_sidedness":1,"temporal_density":0},"merge":{"plain":true,"interfaces":1,"identifications":1}}
